Id,IsDeleted,Name,CreatedDate,LastModifiedDate,SystemModstamp,LastViewedDate,LastReferencedDate,OrderApi__AR_Account__c,OrderApi__Business_Entity_Type__c,OrderApi__Calculate_Sales_Tax__c,OrderApi__Credit_Memo_Account__c,OrderApi__Customer_Support_URL__c,OrderApi__Default_Payment_Gateway__c,OrderApi__Deposit_Account__c,OrderApi__Description__c,OrderApi__Display_Name__c,OrderApi__Email__c,OrderApi__Enable_Shipping_By_Order_Total__c,OrderApi__Fonteva_Default_Currency__c,OrderApi__Homepage_URL__c,OrderApi__Invoice_Footer_HTML__c,OrderApi__Invoice_Footer__c,OrderApi__Invoice_Header_Fieldset_CSV__c,OrderApi__Invoice_Header_HTML__c,OrderApi__Invoice_Header__c,OrderApi__Invoice_Lines_Fieldset__c,OrderApi__Invoice_OverPayment_Credit_Memo_Limit__c,OrderApi__Invoice_Page_Override__c,OrderApi__Invoice_Write_off_Account__c,OrderApi__Invoice_Write_off_Limit__c,OrderApi__Is_Master__c,OrderApi__Mailing_Address__c,OrderApi__Merchant_Location__c,OrderApi__Merchant_Name__c,OrderApi__Parent_Business_Group__c,OrderApi__Phone__c,OrderApi__Proforma_Invoice_Authentication_Required__c,OrderApi__Proforma_Invoice_Email_Body__c,OrderApi__Proforma_Invoice_Email_From_Address__c,OrderApi__Proforma_Invoice_Email_From_Name__c,OrderApi__Proforma_Invoice_Email_Subject__c,OrderApi__Proforma_Invoice_Footer__c,OrderApi__Proforma_Invoice_Header__c,OrderApi__Receipt_Footer_HTML__c,OrderApi__Receipt_Header_Fieldset_CSV__c,OrderApi__Receipt_Header_HTML__c,OrderApi__Receipt_Lines_Fieldset__c,OrderApi__Receipt_Page_Override__c,OrderApi__Required_Tax_Fields_CSV__c,OrderApi__Shipping_Rate_Basis__c,OrderApi__Theme__c,OrderApi__Transfers_Payable_Account__c,OrderApi__Transfers_Receivable_Account__c,OrderApi__Type__c,OrderApi__AR_Account__r.Id,OrderApi__Credit_Memo_Account__r.Id,OrderApi__Default_Payment_Gateway__r.Id,OrderApi__Deposit_Account__r.Id,OrderApi__Invoice_Write_off_Account__r.Id,OrderApi__Parent_Business_Group__r.Id,OrderApi__Theme__r.Name,OrderApi__Transfers_Payable_Account__r.Id,OrderApi__Transfers_Receivable_Account__r.Id
a0sR0000004M9vaIAC,false,FON-International Association,2020-09-14T10:14:06.000+0000,2020-09-25T06:25:37.000+0000,2020-09-25T06:25:37.000+0000,2020-09-25T06:31:50.000+0000,2020-09-25T06:31:50.000+0000,a14R0000004sdQpIAI,Non-Profit 501(c)(6),true,,www.ia.org/support,,a14R0000004sdQuIAI,Association,International Association,billing@ia.org,false,,www.ia.org,<p><b>Payment Terms &amp; Conditions</b></p><p>Thank you for your business. <b>You can pay this invoice online by logging into your account and selecting the &quot;Make a Payment&quot; from the profile page.</b> <b>All major credit cards are accepted.</b></p>,,OrderApi__Invoice_Header_Fieldset,<p>Please let us know if you have questions about this Invoice.Thank you for</p><p>your order!</p>,,OrderApi__Invoice_Line_Fieldset,10,,,1,true,"4420 North Fairfax Drive, Suite 500, Arlington VA 22203, United States","Washington, DC",International Association,,(888) 555-1234,false,"<p>Thank you for requesting a quote! Please see the attached Proforma Invoice (quote) for your desired item. When you are ready to proceed, payment for the requested quote can be made online by clicking the &quot;Make a payment&quot; link below.</p>",,International Association,Here is your Quote!,,,"<p><b>Return Policy</b></p><p>If you are not entirely satisfied with your purchase, we&#39;re here to help. Please call customer service immediately. </p><p>Thank you!</p>",Receipt_Info,<p>Here is a copy of your receipt.Thank you for</p><p>your order!</p>,OrderApi__Receipt_Line_Fieldset,,OrderApi__Shipping_State__c,Item Weight,,a14R0000004sdQqIAI,a14R0000004sdQpIAI,Business Entity,a14R0000004sdQpIAI,,,a14R0000004sdQuIAI,,,,a14R0000004sdQqIAI,a14R0000004sdQpIAI
a0sR0000004MN0xIAG,false,FON-International Association,2020-09-25T06:32:13.000+0000,2020-09-25T06:32:22.000+0000,2020-09-25T06:32:22.000+0000,2020-09-25T06:32:22.000+0000,2020-09-25T06:32:22.000+0000,a14R0000004sh83IAA,Non-Profit 501(c)(6),true,a14R0000004sh8GIAQ,www.ia.org/support,a1GR0000004bkD1MAI,a14R0000004sh88IAA,Association,International Association,billing@ia.org,false,,www.ia.org,<p><b>Payment Terms &amp; Conditions</b></p><p>Thank you for your business. <b>You can pay this invoice online by logging into your account and selecting the &quot;Make a Payment&quot; from the profile page.</b> <b>All major credit cards are accepted.</b></p>,,OrderApi__Invoice_Header_Fieldset,<p>Please let us know if you have questions about this Invoice.Thank you for</p><p>your order!</p>,,OrderApi__Invoice_Line_Fieldset,10,,a14R0000004sh8HIAQ,1,true,"4420 North Fairfax Drive, Suite 500, Arlington VA 22203, United States","Washington, DC",International Association,,(888) 555-1234,false,"<p>Thank you for requesting a quote! Please see the attached Proforma Invoice (quote) for your desired item. When you are ready to proceed, payment for the requested quote can be made online by clicking the &quot;Make a payment&quot; link below.</p>",,International Association,Here is your Quote!,,,"<p><b>Return Policy</b></p><p>If you are not entirely satisfied with your purchase, we&#39;re here to help. Please call customer service immediately. </p><p>Thank you!</p>",Receipt_Info,<p>Here is a copy of your receipt.Thank you for</p><p>your order!</p>,OrderApi__Receipt_Line_Fieldset,,OrderApi__Shipping_State__c,Item Weight,a0hR000000BUT0NIAX,a14R0000004sh84IAA,a14R0000004sh83IAA,Business Entity,a14R0000004sh83IAA,a14R0000004sh8GIAQ,a1GR0000004bkD1MAI,a14R0000004sh88IAA,a14R0000004sh8HIAQ,,FON-INTERNATIONAL ASSOCIATION: MEMBERNATION THEME,a14R0000004sh84IAA,a14R0000004sh83IAA
a0sR0000004MN10IAG,false,FON-North American Society,2020-09-25T06:32:13.000+0000,2020-09-25T06:32:22.000+0000,2020-09-25T06:32:22.000+0000,2020-09-25T06:32:22.000+0000,2020-09-25T06:32:22.000+0000,a14R0000004sh8qIAA,Non-Profit 501(c)(6),false,a14R0000004sh93IAA,,a1GR0000004bkD2MAI,a14R0000004sh8pIAA,Association VA Chapter,Association VA Chapter,vachapter@association.com,false,,http://www.fonteva.com,,,OrderApi__Invoice_Header_Fieldset,,,OrderApi__Invoice_Line_Fieldset,10,,a14R0000004sh94IAA,50,true,"4421 Braddock Rd. Alexandria, VA 22301","New York, NY",IA North America,a0sR0000004MN0xIAG,(703) 555-4444,false,"<table class=""ql-table-blob"" border=""0""><tbody><tr><td colspan=""3"" rowspan=""1"">
			<table border=""0"" cellpadding=""0"" cellspacing=""0""><tbody><tr><td colspan=""1"" rowspan=""1"">Please click the link below to view your proforma invoice</td></tr></tbody></table>
			</td></tr></tbody></table><p><br></p>",,National Professional Association,You have a new proforma invoice,,,,OrderApi__Receipt_Header_Fieldset,,OrderApi__Receipt_Line_Fieldset,,,Item Weight,a0hR000000BUT0NIAX,a14R0000004sh8rIAA,a14R0000004sh8qIAA,Affiliate,a14R0000004sh8qIAA,a14R0000004sh93IAA,a1GR0000004bkD2MAI,a14R0000004sh8pIAA,a14R0000004sh94IAA,a0sR0000004MN0xIAG,FON-INTERNATIONAL ASSOCIATION: MEMBERNATION THEME,a14R0000004sh8rIAA,a14R0000004sh8qIAA
a0sR0000004MN0yIAG,false,FON-Foundation,2020-09-25T06:32:13.000+0000,2020-09-25T06:32:22.000+0000,2020-09-25T06:32:22.000+0000,2020-09-25T06:32:22.000+0000,2020-09-25T06:32:22.000+0000,a14R0000004sh8KIAQ,Non-Profit 501(c)(3),false,a14R0000004sh8XIAQ,,a1GR0000004bkD0MAI,a14R0000004sh8JIAQ,Foundation,Foundation,foundation@npa.org,false,,http://www.fonteva.com,,,OrderApi__Invoice_Header_Fieldset,,,OrderApi__Invoice_Line_Fieldset,10,,a14R0000004sh8YIAQ,50,true,"401 F St NW, Washington, DC 20001","Washington, DC",IA Foundation,,(703) 555-4444,false,Please click the link below to view your proforma invoice,,National Professional Association Undo,You have a new proforma invoice,,,,Receipt_Info,,OrderApi__Receipt_Line_Fieldset,,OrderApi__Shipping_State__c,Item Weight,a0hR000000BUT0NIAX,a14R0000004sh8LIAQ,a14R0000004sh8KIAQ,Business Entity,a14R0000004sh8KIAQ,a14R0000004sh8XIAQ,a1GR0000004bkD0MAI,a14R0000004sh8JIAQ,a14R0000004sh8YIAQ,,FON-INTERNATIONAL ASSOCIATION: MEMBERNATION THEME,a14R0000004sh8LIAQ,a14R0000004sh8KIAQ
a0sR0000004MN0zIAG,false,FON-European Society,2020-09-25T06:32:13.000+0000,2020-09-25T06:32:22.000+0000,2020-09-25T06:32:22.000+0000,2020-09-25T06:32:22.000+0000,2020-09-25T06:32:22.000+0000,a14R0000004sh8aIAA,Non-Profit 501(c)(6),false,a14R0000004sh8nIAA,,a1GR0000004bkCzMAI,a14R0000004sh8ZIAQ,Association UK Chapter,Association UK Chapter,ukchapter@association.com,false,,http://www.fonteva.com,,,OrderApi__Invoice_Header_Fieldset,,,OrderApi__Invoice_Line_Fieldset,10,,a14R0000004sh8oIAA,50,true,"Suite 304 Oriel House 26 The Quadrant Richmond, UK TW9 1DL","Richmond, UK",IA Europe,a0sR0000004MN0xIAG,0203 8466330,false,,,National Professional Association,You have a new proforma invoice,Please click the link below to view your proforma invoice,,,OrderApi__Receipt_Header_Fieldset,,OrderApi__Receipt_Line_Fieldset,,OrderApi__Shipping_State__c,Item Weight,a0hR000000BUT0NIAX,a14R0000004sh8bIAA,a14R0000004sh8aIAA,Affiliate,a14R0000004sh8aIAA,a14R0000004sh8nIAA,a1GR0000004bkCzMAI,a14R0000004sh8ZIAQ,a14R0000004sh8oIAA,a0sR0000004MN0xIAG,FON-INTERNATIONAL ASSOCIATION: MEMBERNATION THEME,a14R0000004sh8bIAA,a14R0000004sh8aIAA
